{
  "schema": "ge16.evidence.v1",
  "evidence_id": "ev0123456789abcdef",
  "kind": "news",
  "payload": {
    "query": "feed:Utusan Malaysia",
    "title": "Sample story",
    "date": "2026-09-26T06:01:40+00:00",
    "source": "Utusan Malaysia",
    "link": "https://www.utusan.com.my/x/?utm_source=rss&#038;utm_medium=rss",
    "lang": "ms",
    "category": "legal",
    "blocs": [],
    "parties": [
      "UMNO"
    ],
    "seats": [],
    "score": 0.8,
    "judged_at": "2026-09-26T06:09:16+00:00",
    "backfill": true
  },
  "source_ref": {
    "file": "data/canonical/research/trackers/ge16-news-accepted.json",
    "sha256": "6b6040967da8407e0d844ff5b23946c2560b54475307e4517c538417f3d337b1",
    "offset": 0
  },
  "collected_at": "2026-09-26T06:10:31+00:00",
  "normalizer_v": "normalize_link.v1",
  "source_recovery": {
    "checked_at": "2026-09-28T09:00:00+00:00",
    "http_status": 200,
    "final_url": "https://www.utusan.com.my/x/",
    "ok": true
  }
}
